{
  "$schema": "https://json-schema.org/draft/2020-12/schema",
  "$id": "emergentism/ForcePermutationTrial.v1",
  "title": "ForcePermutationTrial.v1",
  "type": "object",
  "required": ["schema_id", "trial_id", "registers", "interactions", "candidates", "rivals", "d3_quantum_specific_gate", "agreement_with_burri_counts_as_correctness", "primary_scalar", "selected_candidate", "evaluation_count", "result_state"],
  "properties": {
    "schema_id": {"const": "ForcePermutationTrial.v1"},
    "trial_id": {"type": "string", "minLength": 1},
    "registers": {"const": ["D1", "D2", "D3", "D4"]},
    "interactions": {"const": ["S", "E", "W", "G"]},
    "candidates": {"type": "array", "minItems": 24, "maxItems": 24},
    "rivals": {"type": "array", "minItems": 3},
    "d3_quantum_specific_gate": {"type": "object"},
    "agreement_with_burri_counts_as_correctness": {"const": false},
    "primary_scalar": {"type": "null"},
    "selected_candidate": {"type": "null"},
    "evaluation_count": {"const": 0},
    "result_state": {"const": "UNRUN"}
  },
  "additionalProperties": false
}
